{
 "classes": [
  {
   "annotations": {
    "auto_generate_codes": true,
    "code": "ACTION",
    "entity_kind": "ObjectTypeDef",
    "generated_code_prefix": "ACT"
   },
   "attributes": [
    {
     "annotations": {
      "data_type": "VARCHAR",
      "display_card": "0..1",
      "display_dtype": "VARCHAR",
      "mandatory": false,
      "property_code": "$NAME",
      "property_label": "Name",
      "section": "Device ID",
      "show_in_edit_views": true
     },
     "description": "Name",
     "kind": "property",
     "name": "name",
     "range": {
      "kind": "datatype",
      "name": "VARCHAR"
     }
    },
    {
     "annotations": {
      "data_type": "DATE",
      "display_card": "0..1",
      "display_dtype": "DATE",
      "mandatory": false,
      "property_code": "ACTION_DATE",
      "property_label": "Monitoring Date",
      "section": "Action Data",
      "show_in_edit_views": true
     },
     "description": "Action Date//Datum der Handlung",
     "kind": "property",
     "name": "action_date",
     "range": {
      "kind": "datatype",
      "name": "DATE"
     }
    },
    {
     "annotations": {
      "data_type": "OBJECT",
      "display_card": "0..1",
      "display_dtype": "OBJECT[PERSON.BAM]",
      "mandatory": false,
      "object_code": "PERSON.BAM",
      "property_code": "ACTING_PERSON",
      "property_label": "Acting Person",
      "section": "Action Data",
      "show_in_edit_views": true
     },
     "description": "Acting Person//Handelnde Person",
     "kind": "property",
     "name": "acting_person",
     "range": {
      "kind": "class",
      "name": "bam_masterdata.datamodel.v0.object_types.Bam"
     }
    },
    {
     "annotations": {
      "data_type": "XML",
      "display_card": "0..1",
      "display_dtype": "XML",
      "mandatory": false,
      "property_code": "$XMLCOMMENTS",
      "property_label": "Comments",
      "section": "Additional Information",
      "show_in_edit_views": true
     },
     "description": "Comments log",
     "kind": "property",
     "name": "xmlcomments",
     "range": {
      "kind": "datatype",
      "name": "XML"
     }
    },
    {
     "annotations": {
      "data_type": "XML",
      "display_card": "0..1",
      "display_dtype": "XML",
      "mandatory": false,
      "property_code": "$ANNOTATIONS_STATE",
      "property_label": "Annotations State",
      "show_in_edit_views": true
     },
     "description": "Annotations State",
     "kind": "property",
     "name": "annotations_state",
     "range": {
      "kind": "datatype",
      "name": "XML"
     }
    }
   ],
   "bases": [
    "bam_masterdata.metadata.entities.ObjectType"
   ],
   "description": "This Object allows to store information on an action by a user.//Dieses Objekt erlaubt eine Nutzer-Aktion zu beschreiben.",
   "effective_attributes": [
    {
     "declaring_class_id": "bam_masterdata.datamodel.v0.object_types.Action",
     "kind": "property",
     "name": "name"
    },
    {
     "declaring_class_id": "bam_masterdata.datamodel.v0.object_types.Action",
     "kind": "property",
     "name": "action_date"
    },
    {
     "declaring_class_id": "bam_masterdata.datamodel.v0.object_types.Action",
     "kind": "property",
     "name": "acting_person"
    },
    {
     "declaring_class_id": "bam_masterdata.datamodel.v0.object_types.Action",
     "kind": "property",
     "name": "xmlcomments"
    },
    {
     "declaring_class_id": "bam_masterdata.datamodel.v0.object_types.Action",
     "kind": "property",
     "name": "annotations_state"
    }
   ],
   "id": "bam_masterdata.datamodel.v0.object_types.Action",
   "name": "Action"
  },
  {
   "annotations": {
    "auto_generate_codes": true,
    "code": "MAT_SIM_STRUCTURE.AMORPHOUS",
    "entity_kind": "ObjectTypeDef",
    "generated_code_prefix": "MAT_SIM_STR.AMO"
   },
   "attributes": [
    {
     "annotations": {
      "data_type": "CONTROLLEDVOCABULARY",
      "display_card": "0..1",
      "display_dtype": "CONTROLLEDVOCABULARY[SHORT_RNG_ORD]",
      "mandatory": false,
      "property_code": "ATOM_SHORT_RNG_ORD",
      "property_label": "Short-range Ordering",
      "section": "Material Information",
      "show_in_edit_views": true,
      "vocabulary_code": "SHORT_RNG_ORD"
     },
     "description": "Chains, rings, tetrahedra etc.//Ketten, Ringe, Tetraeder usw.",
     "kind": "property",
     "name": "atom_short_rng_ord",
     "range": {
      "kind": "enum",
      "name": "bam_masterdata.datamodel.v0.vocabulary_types.ShortRngOrd.terms"
     }
    },
    {
     "annotations": {
      "data_type": "VARCHAR",
      "display_card": "0..1",
      "display_dtype": "VARCHAR",
      "mandatory": false,
      "property_code": "CHEM_SPECIES_BY_N_ATOMS",
      "property_label": "Chemical Species (number of atoms)",
      "section": "Simulation Information",
      "show_in_edit_views": true
     },
     "description": "Chemical species involved by number of atoms//Chemische Spezies nach Anzahl der Atome",
     "kind": "property",
     "name": "chem_species_by_n_atoms",
     "range": {
      "kind": "datatype",
      "name": "VARCHAR"
     }
    },
    {
     "annotations": {
      "data_type": "INTEGER",
      "display_card": "0..1",
      "display_dtype": "INTEGER",
      "mandatory": false,
      "property_code": "N_ATOMS_TOTAL",
      "property_label": "Total Number of Atoms",
      "section": "Simulation Information",
      "show_in_edit_views": true
     },
     "description": "Total number of atoms in sample//Gesamtzahl der Atome in der Probe",
     "kind": "property",
     "name": "n_atoms_total",
     "range": {
      "kind": "datatype",
      "name": "INTEGER"
     }
    },
    {
     "annotations": {
      "data_type": "REAL",
      "display_card": "0..1",
      "display_dtype": "REAL",
      "mandatory": false,
      "property_code": "ATOM_SAMPLE_TEMP_IN_K",
      "property_label": "Sample Temperature [K]",
      "section": "Simulation Information",
      "show_in_edit_views": true
     },
     "description": "Current temperature of sample [K]//Aktuelle Temperatur der Probe [K]",
     "kind": "property",
     "name": "atom_sample_temp_in_k",
     "range": {
      "kind": "datatype",
      "name": "REAL"
     }
    }
   ],
   "bases": [
    "bam_masterdata.datamodel.v0.object_types.MatSimStructure"
   ],
   "description": "Material simulation structure - amorphous//Material-simulationsstruktur - amorph",
   "effective_attributes": [
    {
     "declaring_class_id": "bam_masterdata.datamodel.v0.object_types.MatSimStructure",
     "kind": "property",
     "name": "name"
    },
    {
     "declaring_class_id": "bam_masterdata.datamodel.v0.object_types.MatSimStructure",
     "kind": "property",
     "name": "description"
    },
    {
     "declaring_class_id": "bam_masterdata.datamodel.v0.object_types.MatSimStructure",
     "kind": "property",
     "name": "workflow_manager"
    },
    {
     "declaring_class_id": "bam_masterdata.datamodel.v0.object_types.MatSimStructure",
     "kind": "property",
     "name": "crystal_orientation"
    },
    {
     "declaring_class_id": "bam_masterdata.datamodel.v0.object_types.MatSimStructure",
     "kind": "property",
     "name": "sim_cell_lengths_in_a"
    },
    {
     "declaring_class_id": "bam_masterdata.datamodel.v0.object_types.MatSimStructure",
     "kind": "property",
     "name": "sim_cell_vectors"
    },
    {
     "declaring_class_id": "bam_masterdata.datamodel.v0.object_types.MatSimStructure",
     "kind": "property",
     "name": "sim_cell_angles_in_deg"
    },
    {
     "declaring_class_id": "bam_masterdata.datamodel.v0.object_types.MatSimStructure",
     "kind": "property",
     "name": "sim_cell_volume_in_a3"
    },
    {
     "declaring_class_id": "bam_masterdata.datamodel.v0.object_types.MatSimStructure",
     "kind": "property",
     "name": "notes"
    },
    {
     "declaring_class_id": "bam_masterdata.datamodel.v0.object_types.MatSimStructure",
     "kind": "property",
     "name": "conceptual_dictionary"
    },
    {
     "declaring_class_id": "bam_masterdata.datamodel.v0.object_types.MatSimStructure",
     "kind": "property",
     "name": "xmlcomments"
    },
    {
     "declaring_class_id": "bam_masterdata.datamodel.v0.object_types.MatSimStructure",
     "kind": "property",
     "name": "annotations_state"
    },
    {
     "declaring_class_id": "bam_masterdata.datamodel.v0.object_types.Amorphous",
     "kind": "property",
     "name": "atom_short_rng_ord"
    },
    {
     "declaring_class_id": "bam_masterdata.datamodel.v0.object_types.Amorphous",
     "kind": "property",
     "name": "chem_species_by_n_atoms"
    },
    {
     "declaring_class_id": "bam_masterdata.datamodel.v0.object_types.Amorphous",
     "kind": "property",
     "name": "n_atoms_total"
    },
    {
     "declaring_class_id": "bam_masterdata.datamodel.v0.object_types.Amorphous",
     "kind": "property",
     "name": "atom_sample_temp_in_k"
    }
   ],
   "id": "bam_masterdata.datamodel.v0.object_types.Amorphous",
   "name": "Amorphous"
  },
  {
   "annotations": {
    "auto_generate_codes": true,
    "code": "PERSON.BAM",
    "entity_kind": "ObjectTypeDef",
    "generated_code_prefix": "S"
   },
   "attributes": [
    {
     "annotations": {
      "data_type": "CONTROLLEDVOCABULARY",
      "display_card": "1..1",
      "display_dtype": "CONTROLLEDVOCABULARY[BAM_OE]",
      "mandatory": true,
      "property_code": "BAM_OE",
      "property_label": "BAM Organizational Entity",
      "section": "BAM Information",
      "show_in_edit_views": true,
      "vocabulary_code": "BAM_OE"
     },
     "description": "BAM Organizational Entity//BAM Organisationseinheit (OE)",
     "kind": "property",
     "name": "bam_oe",
     "range": {
      "kind": "datatype",
      "name": "CONTROLLEDVOCABULARY"
     }
    },
    {
     "annotations": {
      "data_type": "VARCHAR",
      "display_card": "1..1",
      "display_dtype": "VARCHAR",
      "mandatory": true,